{
  "checkpoint_id": "controller-write-path-resync-2026-03-14-1922",
  "checkpoint_version": "0.1.0",
  "created_at": "2026-03-14T19:22:00-04:00",
  "protected_core": {
    "task_goal": "Resync controller truth after read-path repair so Main continues automatically into the real write execution path.",
    "expected_output": "Fresh controller checkpoint and report plus aligned dispatch and ledger truth for the active write-path wave.",
    "current_step": "Record real write execution path as the active auto wave and clear stale terminal-state drift from prior controller closeout artifacts.",
    "resume_point": "Continue real write execution path with confirmed booking execution, stale-resource recheck, and idempotent replay.",
    "hard_constraints": [
      "Accepted contracts remain frozen.",
      "Only controller may emit final ABORT.",
      "Missing evidence fails soft to HOLD or REVIEW, never ABORT.",
      "Do not enable controller flags globally unless explicitly requested.",
      "Do not reopen closed lanes without the required exact blocker packet."
    ],
    "business_invariants": [
      "Memphis-only 90 day PoC scope remains frozen.",
      "Instinct8 runtime-hook capability stays additive and default-off.",
      "Read-path repair is closed with fresh verification.",
      "Write-path is the next active delivery wave."
    ]
  },
  "compaction": {
    "strategy_name": "Strategy B - Codex-Style Checkpoint",
    "compaction_sequence": 10,
    "halo_summary": "Read-path blocker is closed, queue truth is advanced, and real write execution path is now the active non-terminal auto wave across controller surfaces.",
    "recent_turn_ids": [],
    "drift_status": "stable"
  },
  "validated_artifacts": [
    "dispatch-board.md",
    "artifact-ledger.md",
    "decisions.md",
    "runbook.md",
    "reports/2026-03-14-1439-controller-approval-authority-resync-checkpoint.json",
    "reports/2026-03-14-1439-controller-approval-authority-resync-report.md",
    "tests/b2b3/test_b2b3_scaffold.py",
    "contracts/tests/validate_active_contracts.py",
    "frontend/tests/chat-shell.test.js",
    "frontend/tests/response-model.test.js",
    "contracts/controller-checkpoint-schema.json"
  ],
  "active_failure_signal": {
    "kind": "none",
    "severity": "none",
    "source": "controller",
    "details": null
  },
  "controller_last_decision": {
    "action": "continue",
    "reason": "read_path_repair_closed_write_path_auto_wave_active",
    "source": "controller"
  },
  "queue": {
    "wave_name": "real write execution path",
    "status": "active",
    "run_policy": "auto",
    "eligible": true,
    "requires_explicit_request": false,
    "approval_authority": "main"
  },
  "terminal_state": null
}
