{
  "checkpoint_id": "controlled-flag-on-validation-2026-03-14-1352",
  "checkpoint_version": "0.1.0",
  "created_at": "2026-03-14T13:52:00-04:00",
  "protected_core": {
    "task_goal": "Complete controller hardening and validate that Main can self-approve safe internal controller waves without pausing for the user.",
    "expected_output": "Green validation evidence, aligned control docs, and a contract-valid closeout checkpoint with no remaining runnable wave.",
    "current_step": "Record the controlled flag-on validation closeout and final terminal state.",
    "resume_point": "No active wave. Reopen only on a fresh exact blocker packet or a new approved-scope controller wave.",
    "hard_constraints": [
      "Accepted contracts remain frozen.",
      "Only controller may emit final ABORT.",
      "Missing evidence fails soft to HOLD or REVIEW, never ABORT.",
      "Do not enable controller flags globally unless explicitly requested.",
      "Do not reopen closed lanes without the required exact blocker packet."
    ],
    "business_invariants": [
      "Memphis-only 90 day PoC scope remains frozen.",
      "Instinct8 runtime-hook capability stays additive and default-off unless a controlled validation wave requests it.",
      "B4 remains closed."
    ]
  },
  "compaction": {
    "strategy_name": "Strategy B - Codex-Style Checkpoint",
    "compaction_sequence": 8,
    "halo_summary": "Controlled flag-on validation ran under Main approval authority and closed green. No user-approval-gated or auto-runnable wave remains, so the current terminal state is DONE.",
    "recent_turn_ids": [],
    "drift_status": "stable"
  },
  "validated_artifacts": [
    "backend/app/controller/policy.py",
    "backend/app/controller/models.py",
    "backend/app/controller/runtime.py",
    "backend/app/orchestrator/graph.py",
    "tests/controller/test_controller_policy.py",
    "tests/controller/test_controller_runtime.py",
    "tests/controller/test_controller_scaffold.py",
    "tests/b1/test_b1_scaffold.py",
    "tests/b2b3/test_b2b3_scaffold.py",
    "tests/b5/test_b5_scaffold.py",
    "contracts/controller-checkpoint-schema.json",
    "contracts/tests/validate_controller_checkpoint_contract.py",
    "contracts/tests/validate_active_contracts.py",
    "decisions.md",
    "runbook.md",
    "dispatch-board.md",
    "reports/README.md",
    "docs/plans/queue-finalization-contract.md"
  ],
  "active_failure_signal": {
    "kind": "none",
    "severity": "none",
    "source": "controller",
    "details": null
  },
  "controller_last_decision": {
    "action": "continue",
    "reason": "controlled_flag_on_validation_closed_green",
    "source": "controller"
  },
  "queue": null,
  "terminal_state": "DONE"
}
