{
  "checkpoint_id": "controller-next-wave-2026-03-14-1027",
  "checkpoint_version": "0.1.0",
  "created_at": "2026-03-14T10:27:29Z",
  "protected_core": {
    "task_goal": "Continue main execution from current repo truth with default-off behavior preserved, closed lanes left closed, and the next controller wave narrowed to non-blocking decision tightening.",
    "expected_output": "Contract-valid controller checkpoint and queue state for the next controller wave.",
    "current_step": "Advance from runtime-hook closeout into the next queued controller wave without reopening any closed lane.",
    "resume_point": "Continue default-off main execution; next active wave is controller follow-up decision tightening. Reopen closed lanes only with artifact-backed exact failures.",
    "hard_constraints": [
      "Accepted contracts remain frozen.",
      "Only controller may emit final ABORT.",
      "Missing evidence fails soft to HOLD or REVIEW, never ABORT.",
      "Do not enable controller flags globally unless explicitly requested.",
      "Do not reopen closed lanes without the required exact blocker packet."
    ],
    "business_invariants": [
      "Memphis-only 90 day PoC scope remains frozen.",
      "Single-step booking remains the only in-scope write contract.",
      "B1 and B2+B3 stay accepted.",
      "B5 stays green on fresh workspace verification.",
      "Instinct8 runtime-hook capability stays additive and default-off.",
      "B4 remains closed."
    ]
  },
  "compaction": {
    "strategy_name": "Strategy B - Codex-Style Checkpoint",
    "compaction_sequence": 3,
    "halo_summary": "Runtime-hook slice is complete and green. No active implementation blocker remains in repo state. Next queued wave is controller follow-up decision tightening while default-off behavior continues.",
    "recent_turn_ids": [],
    "drift_status": "stable"
  },
  "validated_artifacts": [
    "reports/2026-03-14-1026-controller-runtime-hook-checkpoint.json",
    "dispatch-board.md",
    "artifact-ledger.md",
    "decisions.md",
    "backend/app/config.py",
    "backend/app/controller/runtime.py",
    "backend/app/orchestrator/graph.py",
    "tests/controller/test_controller_runtime.py"
  ],
  "active_failure_signal": {
    "kind": "none",
    "severity": "none",
    "source": "controller",
    "details": null
  },
  "controller_last_decision": {
    "action": "continue",
    "reason": "runtime_hook_complete_advance_to_next_queued_wave",
    "source": "controller"
  },
  "queue": {
    "wave_name": "Decision Tightening",
    "status": "active",
    "run_policy": "auto",
    "eligible": true,
    "requires_explicit_request": false
  },
  "terminal_state": null
}
